{
  "id": "61bff734-8f8e-4ccb-8e4b-47e33572ae8d",
  "title": "Classic Western Omelet",
  "authors": [
    "Admin"
  ],
  "ingredients": [
    {
      "section": "Filling",
      "items": [
        {
          "ingredient": "Unsalted Butter",
          "volume_ml": 29.574,
          "note": "Divided"
        },
        {
          "ingredient": "Red Bell Pepper",
          "form": [
            "diced"
          ],
          "volume_ml": 59.147
        },
        {
          "ingredient": "Green Bell Pepper",
          "form": [
            "diced"
          ],
          "volume_ml": 59.147
        },
        {
          "ingredient": "Yellow Onion",
          "form": [
            "diced"
          ],
          "volume_ml": 59.147
        },
        {
          "ingredient": "Scallion",
          "form": [
            "sliced"
          ],
          "count": 1,
          "note": "Thinly"
        },
        {
          "ingredient": "Deli Ham",
          "form": [
            "sliced",
            "chopped"
          ],
          "count": 2
        },
        {
          "ingredient": "Pepper Jack Cheese",
          "form": [
            "shredded"
          ],
          "volume_ml": 59.147
        }
      ]
    },
    {
      "section": "Egg Mix",
      "items": [
        {
          "ingredient": "Egg",
          "form": [
            "large"
          ],
          "count": 3
        },
        {
          "ingredient": "Salt",
          "volume_ml": 1.232
        }
      ]
    }
  ],
  "instructions": [
    {
      "action": "saute",
      "content": "Melt 1 tablespoon of the butter in a non-stick skillet over medium heat. Add the bell peppers and onions and saute until softened. Add the ham, scallion, and black pepper. Cook for 1-2 minutes and transfer the mixture. Clean the skillet."
    },
    {
      "action": "whisk",
      "content": "Whisk together the eggs and salt while the skillet reheats."
    },
    {
      "action": "assemble",
      "content": "Coat the skillet with the remaining 1 tablespoon of butter. Pour in the egg, and use a rubber spatula to gently tuck the edges of the egg inward. When the egg is half cooked, add the filling and cheese to half of the egg, and fold the empty half of the egg over the filling. Remove from heat and rest for 1 minute."
    },
    {
      "action": "serve",
      "content": "Serve the omelet immediately.",
      "notes": [
        "The omelet might cook better if covered with a lid before removing it from the heat.",
        "If making several omelets before serving, transfer them to a baking pan instead of allowing each omelet to rest for a minute, and store them in a warm oven."
      ]
    }
  ]
}