{
  "id": "8ae58438-9baa-4a8b-8786-e3fd59531e0a",
  "title": "Apple Crinkle",
  "authors": [
    "Lynda Howard"
  ],
  "ingredients": [
    {
      "section": "Apple Mixture",
      "items": [
        {
          "ingredient": "Apple",
          "form": [
            "chopped"
          ],
          "volume_ml": 946.353,
          "note": "Finely"
        },
        {
          "ingredient": "Sugar",
          "volume_ml": 236.588
        },
        {
          "ingredient": "Flour",
          "volume_ml": 118.294
        },
        {
          "ingredient": "Brown Sugar",
          "volume_ml": 118.294
        }
      ]
    },
    {
      "section": "Topping",
      "items": [
        {
          "ingredient": "Oatmeal",
          "volume_ml": 118.294
        },
        {
          "ingredient": "Butter",
          "form": [
            "melted"
          ],
          "volume_ml": 118.294
        },
        {
          "ingredient": "Brown Sugar",
          "volume_ml": 59.147
        },
        {
          "ingredient": "Flour",
          "volume_ml": 29.574
        }
      ]
    }
  ],
  "instructions": [
    {
      "action": "preheat",
      "content": "Preheat oven to 350 degrees."
    },
    {
      "action": "mix",
      "content": "Mix Apples, Sugar, Flour, and Brown Sugar and pour into a buttered pan."
    },
    {
      "action": "mix",
      "content": "Mix Oatmeal, Melted Butter, Brown Sugar, and Flour and pour over apple mixture."
    },
    {
      "action": "bake",
      "content": "Bake for 45 minutes."
    }
  ],
  "timings": [
    {
      "title": "prep",
      "minutes": 10
    },
    {
      "title": "bake",
      "minutes": 45
    }
  ],
  "tags": [
    "dessert",
    "fall",
    "holiday",
    "comfort"
  ],
  "source": "Pantry Potpourri",
  "tools": [
    "Mixing Bowl",
    "Rubber Spatula",
    "Baking Dish"
  ],
  "difficulty": "easy"
}